{
  "$id": "https://munshi.ai/contracts/execution-targets.v1",
  "$schema": "https://json-schema.org/draft/2020-12/schema",
  "title": "execution-targets.v1",
  "description": "The host/user-specific execution-target & resource registry (ADR-0020). Where each plan stage may run and what external resources it needs. Secrets are NEVER inline (P14) — only references (munshi-secrets:/env:). The committed *.example.json is the template; the gitignored deploy/execution-targets.json is the real one.",
  "type": "object",
  "required": ["version", "targets"],
  "additionalProperties": false,
  "properties": {
    "version": { "const": "v1" },
    "default_target": { "type": "string", "description": "name of a target in `targets`" },
    "targets": { "type": "array", "minItems": 1, "items": { "$ref": "#/$defs/Target" } },
    "resources": { "type": "array", "items": { "$ref": "#/$defs/Resource" } }
  },
  "$defs": {
    "Target": {
      "description": "A place work can run.",
      "type": "object",
      "required": ["name", "kind", "arch", "caps"],
      "additionalProperties": false,
      "properties": {
        "name": { "type": "string", "description": "stable id referenced by a plan's `Runs on:` (e.g. bbb, ci, local-mac)" },
        "kind": { "enum": ["ssh", "local", "ci", "k8s"] },
        "host": { "type": "string", "description": "ssh target / address (non-secret); omit for local/ci" },
        "arch": { "enum": ["amd64", "arm64", "multi"] },
        "caps": {
          "type": "array",
          "items": { "enum": ["docker", "compose", "amd64-bot", "gpu", "redis", "multicore", "green-or-skip-gates"] }
        },
        "provision": { "type": "string", "description": "how it is created if not standing (e.g. linode-cli via the akamai-staging token)" },
        "notes": { "type": "string" }
      }
    },
    "Resource": {
      "description": "An external dependency a stage needs (a service, a credential-set, storage, a meeting, a human gate).",
      "type": "object",
      "required": ["name", "kind"],
      "additionalProperties": false,
      "properties": {
        "name": { "type": "string" },
        "kind": { "enum": ["service", "secret", "credential-set", "storage", "meeting", "human-gate"] },
        "endpoint": { "type": "string", "description": "a non-secret URL/address" },
        "secret_ref": {
          "type": "string",
          "description": "a REFERENCE to the secret, never the value (P14)",
          "pattern": "^(munshi-secrets:|env:)"
        },
        "env": { "type": "array", "items": { "type": "string" }, "description": "the env-var names this resource populates" },
        "validate": { "type": "string", "description": "the CHEAP PREFLIGHT that proves this resource actually works (reachable · authenticates · funded/in-balance) — run in planning to surface the failure model before execution, not after (Learning #28)" },
        "notes": { "type": "string" }
      }
    }
  }
}
