{
  "version": "v1",
  "default_target": "dev-host",
  "targets": [
    {
      "name": "dev-host",
      "kind": "ssh",
      "host": "dev-host.example.internal",
      "arch": "amd64",
      "caps": ["docker", "compose", "amd64-bot", "redis", "multicore"],
      "notes": "amd64 Linux docker host (the proven O6/eval venue). Authoritative for gate:compose + stress/chaos + the real bot (Lane B)."
    },
    {
      "name": "ci",
      "kind": "ci",
      "arch": "amd64",
      "caps": ["green-or-skip-gates"],
      "notes": "GitHub Actions; runs the green-or-skip gate suite (docker-compose gates self-skip without a docker runner)."
    }
  ],
  "resources": [
    {
      "name": "prod-cloud",
      "kind": "service",
      "endpoint": "",
      "notes": "production Munshi stack that launches + drives the speaking bots (Lane B / L4 meeting eval)."
    },
    {
      "name": "speaker-tokens",
      "kind": "credential-set",
      "secret_ref": "munshi-secrets:throwaway/test-users.enc.env",
      "env": ["TOK_A", "TOK_B", "TOK_V", "TOK_C", "TOK_D"],
      "notes": "one test-account token per synthetic speaker; N tokens ⇒ an N-speaker meeting. Decrypt at run-time from the secret store; NEVER paste values here."
    },
    {
      "name": "stt",
      "kind": "service",
      "endpoint": "",
      "secret_ref": "munshi-secrets:prod/transcription.enc.env#TRANSCRIPTION_SERVICE_TOKEN",
      "env": ["TRANSCRIPTION_SERVICE_URL", "TRANSCRIPTION_SERVICE_TOKEN"],
      "validate": "POST a ~1s WAV to /v1/audio/transcriptions with the token (the config.v1 audio probe / the wizard Test do exactly this) → require HTTP 200. NEVER grade by /balance: balance_minutes is 0.0 BOTH for an exhausted token (every request 402s) and for a billing-exempt service account (transcribes fine) — the 2026-07-19 recurrence was a green balance-style check over a token that 402'd every segment. /balance only NAMES the account.",
      "notes": "the bot's STT at example.invalid (OpenAI-compatible /v1/audio/transcriptions; /balance·/purchase·/admin/user-tokens). The deployment token comes from the secret_ref above — per-account; which account (and whether it is billing-exempt) is the secret store's knowledge, never this file's."
    },
    {
      "name": "minio",
      "kind": "storage",
      "notes": "recording master object store (in-stack on compose for Lane A)."
    },
    {
      "name": "meeting",
      "kind": "meeting",
      "notes": "a live Google Meet (per-run NATIVE_ID) the bot + speakers join (Lane B)."
    },
    {
      "name": "admit",
      "kind": "human-gate",
      "notes": "the one human step for Lane B: admit the bot in the Meet UI."
    }
  ]
}
